{
  "dag_id": "abc123",
  "dag_display_name": "example-name",
  "is_paused": true,
  "is_stale": true,
  "last_parsed_time": "example-value",
  "last_parse_duration": "example-value",
  "last_expired": "example-value",
  "bundle_name": "example-name",
  "bundle_version": "example-value",
  "relative_fileloc": "example-value",
  "fileloc": "example-value",
  "description": "example-value",
  "timetable_summary": "example-value",
  "timetable_description": "example-value",
  "timetable_partitioned": true,
  "timetable_periodic": true,
  "tags": [],
  "max_active_tasks": 1,
  "max_active_runs": "example-value",
  "max_consecutive_failed_dag_runs": 1,
  "has_task_concurrency_limits": true,
  "has_import_errors": true,
  "next_dagrun_logical_date": "example-value",
  "next_dagrun_data_interval_start": "example-value",
  "next_dagrun_data_interval_end": "example-value",
  "next_dagrun_run_after": "example-value",
  "allowed_run_types": "example-value",
  "owners": [],
  "catchup": true,
  "dag_run_timeout": "example-value",
  "asset_expression": "example-value",
  "doc_md": "example-value",
  "start_date": "example-value",
  "end_date": "example-value",
  "is_paused_upon_creation": "example-value",
  "params": "example-value",
  "render_template_as_native_obj": true,
  "template_search_path": "example-value",
  "timezone": "example-value",
  "last_parsed": "example-value",
  "default_args": "example-value",
  "owner_links": "example-value",
  "is_favorite": true,
  "active_runs_count": 1,
  "is_backfillable": true,
  "file_token": "example-value",
  "concurrency": 1,
  "latest_dag_version": "example-value"
}